date, 1999/01/01, 1999/01/02, 1999/01/03, 1999/01/04, 1999/01/05, 1999/01/06, 1999/01/07, 1999/01/08, 1999/01/09, 1999/01/10, 1999/01/11, 1999/01/12, 1999/01/13, 1999/01/14, 1999/01/15, 1999/01/16, 1999/01/17, 1999/01/18, 1999/01/19, 1999/01/20, 1999/01/21, 1999/01/22, 1999/01/23, 1999/01/24, 1999/01/25, 1999/01/26, 1999/01/27, 1999/01/28, 1999/01/29, 1999/01/30, 1999/01/31, 1999/02/01, 1999/02/02, 1999/02/03, 1999/02/04, 1999/02/05, 1999/02/06, 1999/02/07, 1999/02/08, 1999/02/09, 1999/02/10, 1999/02/11, 1999/02/12, 1999/02/13, 1999/02/14, 1999/02/15, 1999/02/16, 1999/02/17, 1999/02/18, 1999/02/19, 1999/02/20, 1999/02/21, 1999/02/22, 1999/02/23, 1999/02/24, 1999/02/25, 1999/02/26, 1999/02/27, 1999/02/28, 1999/02/29, 1999/02/30, 1999/02/31, 1999/03/01, 1999/03/02, 1999/03/03, 1999/03/04, 1999/03/05, 1999/03/06, 1999/03/07, 1999/03/08, 1999/03/09, 1999/03/10, 1999/03/11, 1999/03/12, 1999/03/13, 1999/03/14, 1999/03/15, 1999/03/16, 1999/03/17, 1999/03/18, 1999/03/19, 1999/03/20, 1999/03/21, 1999/03/22, 1999/03/23, 1999/03/24, 1999/03/25, 1999/03/26, 1999/03/27, 1999/03/28, 1999/03/29, 1999/03/30, 1999/03/31, 1999/04/01, 1999/04/02, 1999/04/03, 1999/04/04, 1999/04/05, 1999/04/06, 1999/04/07, 1999/04/08, 1999/04/09, 1999/04/10, 1999/04/11, 1999/04/12, 1999/04/13, 1999/04/14, 1999/04/15, 1999/04/16, 1999/04/17, 1999/04/18, 1999/04/19, 1999/04/20, 1999/04/21, 1999/04/22, 1999/04/23, 1999/04/24, 1999/04/25, 1999/04/26, 1999/04/27, 1999/04/28, 1999/04/29, 1999/04/30, 1999/04/31, 1999/05/01, 1999/05/02, 1999/05/03, 1999/05/04, 1999/05/05, 1999/05/06, 1999/05/07, 1999/05/08, 1999/05/09, 1999/05/10, 1999/05/11, 1999/05/12, 1999/05/13, 1999/05/14, 1999/05/15, 1999/05/16, 1999/05/17, 1999/05/18, 1999/05/19, 1999/05/20, 1999/05/21, 1999/05/22, 1999/05/23, 1999/05/24, 1999/05/25, 1999/05/26, 1999/05/27, 1999/05/28, 1999/05/29, 1999/05/30, 1999/05/31, 1999/06/01, 1999/06/02, 1999/06/03, 1999/06/04, 1999/06/05, 1999/06/06, 1999/06/07, 1999/06/08, 1999/06/09, 1999/06/10, 1999/06/11, 1999/06/12, 1999/06/13, 1999/06/14, 1999/06/15, 1999/06/16, 1999/06/17, 1999/06/18, 1999/06/19, 1999/06/20, 1999/06/21, 1999/06/22, 1999/06/23, 1999/06/24, 1999/06/25, 1999/06/26, 1999/06/27, 1999/06/28, 1999/06/29, 1999/06/30, 1999/06/31, 1999/07/01, 1999/07/02, 1999/07/03, 1999/07/04, 1999/07/05, 1999/07/06, 1999/07/07, 1999/07/08, 1999/07/09, 1999/07/10, 1999/07/11, 1999/07/12, 1999/07/13, 1999/07/14, 1999/07/15, 1999/07/16, 1999/07/17, 1999/07/18, 1999/07/19, 1999/07/20, 1999/07/21, 1999/07/22, 1999/07/23, 1999/07/24, 1999/07/25, 1999/07/26, 1999/07/27, 1999/07/28, 1999/07/29, 1999/07/30, 1999/07/31, 1999/08/01, 1999/08/02, 1999/08/03, 1999/08/04, 1999/08/05, 1999/08/06, 1999/08/07, 1999/08/08, 1999/08/09, 1999/08/10, 1999/08/11, 1999/08/12, 1999/08/13, 1999/08/14, 1999/08/15, 1999/08/16, 1999/08/17, 1999/08/18, 1999/08/19, 1999/08/20, 1999/08/21, 1999/08/22, 1999/08/23, 1999/08/24, 1999/08/25, 1999/08/26, 1999/08/27, 1999/08/28, 1999/08/29, 1999/08/30, 1999/08/31, 1999/09/01, 1999/09/02, 1999/09/03, 1999/09/04, 1999/09/05, 1999/09/06, 1999/09/07, 1999/09/08, 1999/09/09, 1999/09/10, 1999/09/11, 1999/09/12, 1999/09/13, 1999/09/14, 1999/09/15, 1999/09/16, 1999/09/17, 1999/09/18, 1999/09/19, 1999/09/20, 1999/09/21, 1999/09/22, 1999/09/23, 1999/09/24, 1999/09/25, 1999/09/26, 1999/09/27, 1999/09/28, 1999/09/29, 1999/09/30, 1999/09/31, 1999/10/01, 1999/10/02, 1999/10/03, 1999/10/04, 1999/10/05, 1999/10/06, 1999/10/07, 1999/10/08, 1999/10/09, 1999/10/10, 1999/10/11, 1999/10/12, 1999/10/13, 1999/10/14, 1999/10/15, 1999/10/16, 1999/10/17, 1999/10/18, 1999/10/19, 1999/10/20, 1999/10/21, 1999/10/22, 1999/10/23, 1999/10/24, 1999/10/25, 1999/10/26, 1999/10/27, 1999/10/28, 1999/10/29, 1999/10/30, 1999/10/31, 1999/11/01, 1999/11/02, 1999/11/03, 1999/11/04, 1999/11/05, 1999/11/06, 1999/11/07, 1999/11/08, 1999/11/09, 1999/11/10, 1999/11/11, 1999/11/12, 1999/11/13, 1999/11/14, 1999/11/15, 1999/11/16, 1999/11/17, 1999/11/18, 1999/11/19, 1999/11/20, 1999/11/21, 1999/11/22, 1999/11/23, 1999/11/24, 1999/11/25, 1999/11/26, 1999/11/27, 1999/11/28, 1999/11/29, 1999/11/30, 1999/11/31, 1999/12/01, 1999/12/02, 1999/12/03, 1999/12/04, 1999/12/05, 1999/12/06, 1999/12/07, 1999/12/08, 1999/12/09, 1999/12/10, 1999/12/11, 1999/12/12, 1999/12/13, 1999/12/14, 1999/12/15, 1999/12/16, 1999/12/17, 1999/12/18, 1999/12/19, 1999/12/20, 1999/12/21, 1999/12/22, 1999/12/23, 1999/12/24, 1999/12/25, 1999/12/26, 1999/12/27, 1999/12/28, 1999/12/29, 1999/12/30, 1999/12/31
char1, 비견, 상관, 식신, 정재, 편재, 정관, 편관, 정인, 편인, 겁재, 비견, 상관, 식신, 정재, 편재, 정관, 편관, 정인, 편인, 겁재, 비견, 상관, 식신, 정재, 편재, 정관, 편관, 정인, 편인, 겁재, 비견, 상관, 식신, 정재, 편재, 정관, 편관, 정인, 편인, 겁재, 비견, 상관, 식신, 정재, 편재, 정관, 편관, 정인, 편인, 겁재, 비견, 상관, 식신, 정재, 편재, 정관, 편관, 정인, 편인, , , , 겁재, 비견, 상관, 식신, 정재, 편재, 정관, 편관, 정인, 편인, 겁재, 비견, 상관, 식신, 정재, 편재, 정관, 편관, 정인, 편인, 겁재, 비견, 상관, 식신, 정재, 편재, 정관, 편관, 정인, 편인, 겁재, 비견, 상관, 식신, 정재, 편재, 정관, 편관, 정인, 편인, 겁재, 비견, 상관, 식신, 정재, 편재, 정관, 편관, 정인, 편인, 겁재, 비견, 상관, 식신, 정재, 편재, 정관, 편관, 정인, 편인, 겁재, , 비견, 상관, 식신, 정재, 편재, 정관, 편관, 정인, 편인, 겁재, 비견, 상관, 식신, 정재, 편재, 정관, 편관, 정인, 편인, 겁재, 비견, 상관, 식신, 정재, 편재, 정관, 편관, 정인, 편인, 겁재, 비견, 상관, 식신, 정재, 편재, 정관, 편관, 정인, 편인, 겁재, 비견, 상관, 식신, 정재, 편재, 정관, 편관, 정인, 편인, 겁재, 비견, 상관, 식신, 정재, 편재, 정관, 편관, 정인, 편인, 겁재, 비견, , 상관, 식신, 정재, 편재, 정관, 편관, 정인, 편인, 겁재, 비견, 상관, 식신, 정재, 편재, 정관, 편관, 정인, 편인, 겁재, 비견, 상관, 식신, 정재, 편재, 정관, 편관, 정인, 편인, 겁재, 비견, 상관, 식신, 정재, 편재, 정관, 편관, 정인, 편인, 겁재, 비견, 상관, 식신, 정재, 편재, 정관, 편관, 정인, 편인, 겁재, 비견, 상관, 식신, 정재, 편재, 정관, 편관, 정인, 편인, 겁재, 비견, 상관, 식신, 정재, 편재, 정관, 편관, 정인, 편인, 겁재, 비견, 상관, 식신, 정재, 편재, 정관, 편관, 정인, 편인, 겁재, 비견, 상관, 식신, 정재, 편재, 정관, 편관, 정인, 편인, 겁재, 비견, 상관, 식신, , 정재, 편재, 정관, 편관, 정인, 편인, 겁재, 비견, 상관, 식신, 정재, 편재, 정관, 편관, 정인, 편인, 겁재, 비견, 상관, 식신, 정재, 편재, 정관, 편관, 정인, 편인, 겁재, 비견, 상관, 식신, 정재, 편재, 정관, 편관, 정인, 편인, 겁재, 비견, 상관, 식신, 정재, 편재, 정관, 편관, 정인, 편인, 겁재, 비견, 상관, 식신, 정재, 편재, 정관, 편관, 정인, 편인, 겁재, 비견, 상관, 식신, 정재, , 편재, 정관, 편관, 정인, 편인, 겁재, 비견, 상관, 식신, 정재, 편재, 정관, 편관, 정인, 편인, 겁재, 비견, 상관, 식신, 정재, 편재, 정관, 편관, 정인, 편인, 겁재, 비견, 상관, 식신, 정재, 편재
char2, 일광, 일광, 일광, 일광, 일광, 일광, 일광, 일광, 일광, 일광, 일광, 일광, 일광, 일광, 일광, 일광, 일광, 일광, 일광, 일광, 일광, 일광, 일광, 일광, 일광, 일광, 일광, 일광, 일광, 일광, 일광, 일광, 일광, 일광, 일광, 일광, 일광, 일광, 일광, 일광, 일광, 일광, 일광, 일광, 일광, 일광, 일광, 일광, 일광, 일광, 일광, 일광, 일광, 일광, 일광, 일광, 일광, 일광, 일광, , , , 일광, 일광, 일광, 일광, 일광, 일광, 일광, 일광, 일광, 일광, 일광, 일광, 일광, 일광, 일광, 일광, 일광, 일광, 일광, 일광, 일광, 일광, 일광, 일광, 일광, 일광, 일광, 일광, 일광, 일광, 일광, 일광, 일광, 일광, 일광, 일광, 일광, 일광, 일광, 일광, 일광, 일광, 일광, 일광, 일광, 일광, 일광, 일광, 일광, 일광, 일광, 일광, 일광, 일광, 일광, 일광, 일광, 일광, 일광, 일광, 일광, , 일광, 일광, 일광, 일광, 일광, 일광, 일광, 일광, 일광, 일광, 일광, 일광, 일광, 일광, 일광, 일광, 일광, 일광, 일광, 일광, 일광, 일광, 일광, 일광, 일광, 일광, 일광, 일광, 일광, 일광, 일광, 일광, 일광, 일광, 일광, 일광, 일광, 일광, 일광, 일광, 일광, 일광, 일광, 일광, 일광, 일광, 일광, 일광, 일광, 일광, 일광, 일광, 일광, 일광, 일광, 일광, 일광, 일광, 일광, 일광, 일광, , 일광, 일광, 일광, 일광, 일광, 일광, 일광, 일광, 일광, 일광, 일광, 일광, 일광, 일광, 일광, 일광, 일광, 일광, 일광, 일광, 일광, 일광, 일광, 일광, 일광, 일광, 일광, 일광, 일광, 일광, 일광, 일광, 일광, 일광, 일광, 일광, 일광, 일광, 일광, 일광, 일광, 일광, 일광, 일광, 일광, 일광, 일광, 일광, 일광, 일광, 일광, 일광, 일광, 일광, 일광, 일광, 일광, 일광, 일광, 일광, 일광, 일광, 일광, 일광, 일광, 일광, 일광, 일광, 일광, 일광, 일광, 일광, 일광, 일광, 일광, 일광, 일광, 일광, 일광, 일광, 일광, 일광, 일광, 일광, 일광, 일광, 일광, 일광, 일광, 일광, 일광, 일광, , 일광, 일광, 일광, 일광, 일광, 일광, 일광, 일광, 일광, 일광, 일광, 일광, 일광, 일광, 일광, 일광, 일광, 일광, 일광, 일광, 일광, 일광, 일광, 일광, 일광, 일광, 일광, 일광, 일광, 일광, 일광, 일광, 일광, 일광, 일광, 일광, 일광, 일광, 일광, 일광, 일광, 일광, 일광, 일광, 일광, 일광, 일광, 일광, 일광, 일광, 일광, 일광, 일광, 일광, 일광, 일광, 일광, 일광, 일광, 일광, 일광, , 일광, 일광, 일광, 일광, 일광, 일광, 일광, 일광, 일광, 일광, 일광, 일광, 일광, 일광, 일광, 일광, 일광, 일광, 일광, 일광, 일광, 일광, 일광, 일광, 일광, 일광, 일광, 일광, 일광, 일광, 일광
char3, 식신, 상관, 비견, 겁재, 편인, 편인, 정관, 편관, 정재, 편재, 상관, 식신, 겁재, 비견, 정인, 편인, 정관, 편관, 정재, 편재, 상관, 식신, 겁재, 비견, 정인, 편인, 정관, 편관, 정재, 편재, 상관, 식신, 겁재, 비견, 정인, 겁재, 편인, 정인, 편관, 정관, 편재, 정재, 식신, 상관, 비견, 겁재, 편인, 정인, 편관, 정관, 편재, 정재, 식신, 상관, 비견, 겁재, 편인, 정인, 편관, , , , 정관, 편재, 정재, 식신, 상관, 겁재, 비견, 정인, 편인, 정관, 편관, 정재, 편재, 상관, 식신, 겁재, 비견, 정인, 편인, 정관, 편관, 정재, 편재, 상관, 식신, 겁재, 비견, 정인, 편인, 정관, 편관, 정재, 편재, 상관, 식신, 겁재, 상관, 비견, 겁재, 편인, 정인, 편관, 정관, 편재, 정재, 식신, 상관, 비견, 겁재, 편인, 정인, 편관, 정관, 편재, 정재, 식신, 상관, 비견, 겁재, 편인, 정인, , 편관, 정관, 편재, 정재, 식신, 식신, 겁재, 비견, 정인, 편인, 정관, 편관, 정재, 편재, 상관, 식신, 겁재, 비견, 정인, 편인, 정관, 편관, 정재, 편재, 상관, 식신, 겁재, 비견, 정인, 편인, 정관, 편관, 정재, 편재, 상관, 식신, 겁재, 상관, 비견, 겁재, 편인, 정인, 편관, 정관, 편재, 정재, 식신, 상관, 비견, 겁재, 편인, 정인, 편관, 정관, 편재, 정재, 식신, 상관, 비견, 겁재, 편인, , 정인, 편관, 정관, 편재, 정재, 식신, 상관, 겁재, 비견, 정인, 편인, 정관, 편관, 정재, 편재, 상관, 식신, 겁재, 비견, 정인, 편인, 정관, 편관, 정재, 편재, 상관, 식신, 겁재, 비견, 정인, 편인, 정관, 편관, 정재, 편재, 상관, 식신, 겁재, 상관, 비견, 겁재, 편인, 정인, 편관, 정관, 편재, 정재, 식신, 상관, 비견, 겁재, 편인, 정인, 편관, 정관, 편재, 정재, 식신, 상관, 비견, 겁재, 편인, 정인, 편관, 정관, 편재, 정재, 식신, 상관, 겁재, 비견, 정인, 편인, 정관, 편관, 정재, 편재, 상관, 식신, 겁재, 비견, 정인, 편인, 정관, 편관, 정재, 편재, 상관, 식신, 겁재, 비견, 정인, , 편인, 정관, 편관, 정재, 편재, 상관, 식신, 겁재, 상관, 비견, 겁재, 편인, 정인, 편관, 정관, 편재, 정재, 식신, 상관, 비견, 겁재, 편인, 정인, 편관, 정관, 편재, 정재, 식신, 상관, 비견, 겁재, 편인, 정인, 편관, 정관, 편재, 정재, 식신, 식신, 겁재, 비견, 정인, 편인, 정관, 편관, 정재, 편재, 상관, 식신, 겁재, 비견, 정인, 편인, 정관, 편관, 정재, 편재, 상관, 식신, 겁재, 비견, , 정인, 편인, 정관, 편관, 정재, 편재, 상관, 정재, 식신, 상관, 비견, 겁재, 편인, 정인, 편관, 정관, 편재, 정재, 식신, 상관, 비견, 겁재, 편인, 정인, 편관, 정관, 편재, 정재, 식신, 상관, 비견
char4, 편관, 정관, 편재, 정재, 식신, 상관, 비견, 겁재, 편인, 정인, 편관, 정관, 편재, 정재, 식신, 상관, 비견, 겁재, 편인, 정인, 편관, 정관, 편재, 정재, 식신, 상관, 비견, 겁재, 편인, 정인, 편관, 정관, 편재, 정재, 식신, 식신, 겁재, 비견, 정인, 편인, 정관, 편관, 정재, 편재, 상관, 식신, 겁재, 비견, 정인, 편인, 정관, 편관, 정재, 편재, 상관, 식신, 겁재, 비견, 정인, , , , 편인, 정관, 편관, 정재, 편재, 상관, 식신, 겁재, 비견, 정인, 편인, 정관, 편관, 정재, 편재, 상관, 식신, 겁재, 비견, 정인, 편인, 정관, 편관, 정재, 편재, 상관, 식신, 겁재, 비견, 정인, 편인, 정관, 편관, 정재, 편재, 상관, 식신, 겁재, 비견, 정인, 편인, 정관, 편관, 정재, 편재, 상관, 식신, 겁재, 비견, 정인, 편인, 정관, 편관, 정재, 편재, 상관, 식신, 겁재, 비견, 정인, 편인, , 정관, 편관, 정재, 편재, 상관, 식신, 겁재, 비견, 정인, 편인, 정관, 편관, 정재, 편재, 상관, 식신, 겁재, 비견, 정인, 편인, 정관, 편관, 정재, 편재, 상관, 식신, 겁재, 비견, 정인, 편인, 정관, 편관, 정재, 편재, 상관, 식신, 겁재, 비견, 정인, 편인, 정관, 편관, 정재, 편재, 상관, 식신, 겁재, 비견, 정인, 편인, 정관, 편관, 정재, 편재, 상관, 식신, 겁재, 비견, 정인, 편인, 정관, , 편관, 정재, 편재, 상관, 식신, 겁재, 비견, 정인, 편인, 정관, 편관, 정재, 편재, 상관, 식신, 겁재, 비견, 정인, 편인, 정관, 편관, 정재, 편재, 상관, 식신, 겁재, 비견, 정인, 편인, 정관, 편관, 정재, 편재, 상관, 식신, 겁재, 비견, 정인, 편인, 정관, 편관, 정재, 편재, 상관, 식신, 겁재, 비견, 정인, 편인, 정관, 편관, 정재, 편재, 상관, 식신, 겁재, 비견, 정인, 편인, 정관, 편관, 정재, 편재, 상관, 식신, 겁재, 비견, 정인, 편인, 정관, 편관, 정재, 편재, 상관, 식신, 겁재, 비견, 정인, 편인, 정관, 편관, 정재, 편재, 상관, 식신, 겁재, 비견, 정인, 편인, 정관, 편관, 정재, , 편재, 상관, 식신, 겁재, 비견, 정인, 편인, 정관, 편관, 정재, 편재, 상관, 식신, 겁재, 비견, 정인, 편인, 정관, 편관, 정재, 편재, 상관, 식신, 겁재, 비견, 정인, 편인, 정관, 편관, 정재, 편재, 상관, 식신, 겁재, 비견, 정인, 편인, 정관, 편관, 정재, 편재, 상관, 식신, 겁재, 비견, 정인, 편인, 정관, 편관, 정재, 편재, 상관, 식신, 겁재, 비견, 정인, 편인, 정관, 편관, 정재, 편재, , 상관, 식신, 겁재, 비견, 정인, 편인, 정관, 편관, 정재, 편재, 상관, 식신, 겁재, 비견, 정인, 편인, 정관, 편관, 정재, 편재, 상관, 식신, 겁재, 비견, 정인, 편인, 정관, 편관, 정재, 편재, 상관
char5, 겁재, 비견, 정인, 편인, 정관, 편관, 정재, 편재, 상관, 식신, 겁재, 비견, 정인, 편인, 정관, 편관, 정재, 편재, 상관, 식신, 겁재, 비견, 정인, 편인, 정관, 편관, 정재, 편재, 상관, 식신, 겁재, 비견, 정인, 편인, 정관, 편관, 정재, 편재, 상관, 식신, 겁재, 비견, 정인, 편인, 정관, 편관, 정재, 편재, 상관, 식신, 겁재, 비견, 정인, 편인, 정관, 편관, 정재, 편재, 상관, , , , 식신, 겁재, 비견, 정인, 편인, 정관, 편관, 정재, 편재, 상관, 식신, 겁재, 비견, 정인, 편인, 정관, 편관, 정재, 편재, 상관, 식신, 겁재, 비견, 정인, 편인, 정관, 편관, 정재, 편재, 상관, 식신, 겁재, 비견, 정인, 편인, 정관, 편관, 정재, 편재, 상관, 식신, 겁재, 비견, 정인, 편인, 정관, 편관, 정재, 편재, 상관, 식신, 겁재, 비견, 정인, 편인, 정관, 편관, 정재, 편재, 상관, 식신, , 겁재, 비견, 정인, 편인, 정관, 편관, 정재, 편재, 상관, 식신, 겁재, 비견, 정인, 편인, 정관, 편관, 정재, 편재, 상관, 식신, 겁재, 비견, 정인, 편인, 정관, 편관, 정재, 편재, 상관, 식신, 겁재, 비견, 정인, 편인, 정관, 편관, 정재, 편재, 상관, 식신, 겁재, 비견, 정인, 편인, 정관, 편관, 정재, 편재, 상관, 식신, 겁재, 비견, 정인, 편인, 정관, 편관, 정재, 편재, 상관, 식신, 겁재, , 비견, 정인, 편인, 정관, 편관, 정재, 편재, 상관, 식신, 겁재, 비견, 정인, 편인, 정관, 편관, 정재, 편재, 상관, 식신, 겁재, 비견, 정인, 편인, 정관, 편관, 정재, 편재, 상관, 식신, 겁재, 비견, 정인, 편인, 정관, 편관, 정재, 편재, 상관, 식신, 겁재, 비견, 정인, 편인, 정관, 편관, 정재, 편재, 상관, 식신, 겁재, 비견, 정인, 편인, 정관, 편관, 정재, 편재, 상관, 식신, 겁재, 비견, 정인, 편인, 정관, 편관, 정재, 편재, 상관, 식신, 겁재, 비견, 정인, 편인, 정관, 편관, 정재, 편재, 상관, 식신, 겁재, 비견, 정인, 편인, 정관, 편관, 정재, 편재, 상관, 식신, 겁재, 비견, 정인, , 편인, 정관, 편관, 정재, 편재, 상관, 식신, 겁재, 비견, 정인, 편인, 정관, 편관, 정재, 편재, 상관, 식신, 겁재, 비견, 정인, 편인, 정관, 편관, 정재, 편재, 상관, 식신, 겁재, 비견, 정인, 편인, 정관, 편관, 정재, 편재, 상관, 식신, 겁재, 비견, 정인, 편인, 정관, 편관, 정재, 편재, 상관, 식신, 겁재, 비견, 정인, 편인, 정관, 편관, 정재, 편재, 상관, 식신, 겁재, 비견, 정인, 편인, , 정관, 편관, 정재, 편재, 상관, 식신, 겁재, 비견, 정인, 편인, 정관, 편관, 정재, 편재, 상관, 식신, 겁재, 비견, 정인, 편인, 정관, 편관, 정재, 편재, 상관, 식신, 겁재, 비견, 정인, 편인, 정관
char6, 겁재, 편관, 비견, 비견, 식신, 겁재, 정인, 비견, 비견, 비견, 편관, 겁재, 정인, 편재, 편인, 편인, 비견, 정인, 정관, 편인, 편인, 편인, 편재, 정인, 정관, 식신, 편관, 편관, 편인, 정관, 정재, 편관, 편관, 편관, 식신, 정관, 정재, 비견, 편재, 편재, 편관, 정재, 상관, 편재, 편재, 편재, 비견, 정재, 상관, 편인, 식신, 식신, 편재, 상관, 겁재, 식신, 식신, 식신, 편인, , , , 상관, 겁재, 편관, 비견, 비견, 식신, 겁재, 정인, 비견, 비견, 비견, 편관, 겁재, 정인, 편재, 편인, 편인, 비견, 정인, 정관, 편인, 편인, 편인, 편재, 정인, 정관, 식신, 편관, 편관, 편인, 정관, 정재, 편관, 편관, 편관, 식신, 정관, 정재, 비견, 편재, 편재, 편관, 정재, 상관, 편재, 편재, 편재, 비견, 정재, 상관, 편인, 식신, 식신, 편재, 상관, 겁재, 식신, 식신, 식신, 편인, 상관, , 겁재, 편관, 비견, 비견, 식신, 겁재, 정인, 비견, 비견, 비견, 편관, 겁재, 정인, 편재, 편인, 편인, 비견, 정인, 정관, 편인, 편인, 편인, 편재, 정인, 정관, 식신, 편관, 편관, 편인, 정관, 정재, 편관, 편관, 편관, 식신, 정관, 정재, 비견, 편재, 편재, 편관, 정재, 상관, 편재, 편재, 편재, 비견, 정재, 상관, 편인, 식신, 식신, 편재, 상관, 겁재, 식신, 식신, 식신, 편인, 상관, 겁재, , 편관, 비견, 비견, 식신, 겁재, 정인, 비견, 비견, 비견, 편관, 겁재, 정인, 편재, 편인, 편인, 비견, 정인, 정관, 편인, 편인, 편인, 편재, 정인, 정관, 식신, 편관, 편관, 편인, 정관, 정재, 편관, 편관, 편관, 식신, 정관, 정재, 비견, 편재, 편재, 편관, 정재, 상관, 편재, 편재, 편재, 비견, 정재, 상관, 편인, 식신, 식신, 편재, 상관, 겁재, 식신, 식신, 식신, 편인, 상관, 겁재, 편관, 비견, 비견, 식신, 겁재, 정인, 비견, 비견, 비견, 편관, 겁재, 정인, 편재, 편인, 편인, 비견, 정인, 정관, 편인, 편인, 편인, 편재, 정인, 정관, 식신, 편관, 편관, 편인, 정관, 정재, 편관, 편관, , 편관, 식신, 정관, 정재, 비견, 편재, 편재, 편관, 정재, 상관, 편재, 편재, 편재, 비견, 정재, 상관, 편인, 식신, 식신, 편재, 상관, 겁재, 식신, 식신, 식신, 편인, 상관, 겁재, 편관, 비견, 비견, 식신, 겁재, 정인, 비견, 비견, 비견, 편관, 겁재, 정인, 편재, 편인, 편인, 비견, 정인, 정관, 편인, 편인, 편인, 편재, 정인, 정관, 식신, 편관, 편관, 편인, 정관, 정재, 편관, 편관, 편관, , 식신, 정관, 정재, 비견, 편재, 편재, 편관, 정재, 상관, 편재, 편재, 편재, 비견, 정재, 상관, 편인, 식신, 식신, 편재, 상관, 겁재, 식신, 식신, 식신, 편인, 상관, 겁재, 편관, 비견, 비견, 식신
char7, 겁재, 비견, 정인, 편인, 정관, 식신, 겁재, 비견, 정인, 편인, 정관, 편관, 정재, 편재, 상관, 식신, 겁재, 비견, 정인, 편인, 정관, 편관, 정재, 편재, 상관, 식신, 겁재, 비견, 정인, 편인, 정관, 편관, 정재, 편재, 상관, 정인, 편관, 정관, 편재, 정재, 식신, 상관, 비견, 겁재, 편인, 정인, 편관, 정관, 편재, 정재, 식신, 상관, 비견, 겁재, 편인, 정인, 편관, 정관, 편재, , , , 정재, 식신, 상관, 비견, 겁재, 정인, 편인, 정관, 편관, 정재, 편재, 상관, 식신, 겁재, 비견, 정인, 편인, 정관, 편관, 정재, 편재, 상관, 식신, 겁재, 비견, 정인, 편인, 정관, 편관, 정재, 편재, 상관, 식신, 겁재, 비견, 정인, 상관, 비견, 겁재, 편인, 정인, 편관, 정관, 편재, 정재, 식신, 상관, 비견, 겁재, 편인, 정인, 편관, 정관, 편재, 정재, 식신, 상관, 비견, 겁재, 편인, 정인, , 편관, 정관, 편재, 정재, 식신, 겁재, 편인, 정인, 편관, 정관, 편재, 정재, 식신, 상관, 비견, 겁재, 편인, 정인, 편관, 정관, 편재, 정재, 식신, 상관, 비견, 겁재, 편인, 정인, 편관, 정관, 편재, 정재, 식신, 상관, 비견, 겁재, 편인, 편인, 정관, 편관, 정재, 편재, 상관, 식신, 겁재, 비견, 정인, 편인, 정관, 편관, 정재, 편재, 상관, 식신, 겁재, 비견, 정인, 편인, 정관, 편관, 정재, , 편재, 상관, 식신, 겁재, 비견, 정인, 편인, 정인, 편인, 정관, 편관, 정재, 편재, 상관, 식신, 겁재, 비견, 정인, 편인, 정관, 편관, 정재, 편재, 상관, 식신, 겁재, 비견, 정인, 편인, 정관, 편관, 정재, 편재, 상관, 식신, 겁재, 비견, 정인, 겁재, 편인, 정인, 편관, 정관, 편재, 정재, 식신, 상관, 비견, 겁재, 편인, 정인, 편관, 정관, 편재, 정재, 식신, 상관, 비견, 겁재, 편인, 정인, 편관, 정관, 편재, 정재, 식신, 상관, 비견, 겁재, 정인, 편인, 정관, 편관, 정재, 편재, 상관, 식신, 겁재, 비견, 정인, 편인, 정관, 편관, 정재, 편재, 상관, 식신, 겁재, 비견, 정인, 편인, 정관, , 편관, 정재, 편재, 상관, 식신, 겁재, 비견, 정인, 정관, 편재, 정재, 식신, 상관, 비견, 겁재, 편인, 정인, 편관, 정관, 편재, 정재, 식신, 상관, 비견, 겁재, 편인, 정인, 편관, 정관, 편재, 정재, 식신, 상관, 비견, 겁재, 편인, 정인, 편관, 겁재, 편인, 정인, 편관, 정관, 편재, 정재, 식신, 상관, 비견, 겁재, 편인, 정인, 편관, 정관, 편재, 정재, 식신, 상관, 비견, 겁재, 편인, 정인, , 편관, 정관, 편재, 정재, 식신, 상관, 비견, 비견, 정인, 편인, 정관, 편관, 정재, 편재, 상관, 식신, 겁재, 비견, 정인, 편인, 정관, 편관, 정재, 편재, 상관, 식신, 겁재, 비견, 정인, 편인, 정관
